	customer_id	helpful_votes	marketplace	product_category	product_id	product_parent	product_title	review_body	review_date	review_headline	review_id	star_rating	total_votes	verified_purchase	vine
523	12398719.0	0.0	US	Apparel	B013MAB936	154972192.0	Coffee Lover Gift - Simple & Unique 925 Sterling Silver Coffee Ring Jewelry for Women	I love this coffee ring! It’s so cute and so “me;” I love coffee and silver jewelry! The ring fit nicely, true to size and since there is a gap between the top of the cup and the steam, it can be gently adjusted if necessary.<br />The one thing that keeps this from being an everyday ring for me is that gap between the cup and steam; it seems to keep getting caught on my hair. Cute for a few hours at a time, though :)<br />*Product received at a discount in exchange for honest review*	2015-08-23	I love this coffee ring	RVDDLESK9NKPP	4.0	0.0	N	N
524	1054019.0	0.0	US	Apparel	B013M79DV4	205133662.0	Koloa Surf Co. Wave Logo Long Sleeve Dri-Equip Athletic Shirts - Reg, Big & Tall	Perfect everything was as expected	2015-08-31	A happy customer	R182BDYA2QJC0I	5.0	1.0	Y	N
525	13363910.0	0.0	US	Apparel	B013M414WI	960978951.0	Koloa Surf Wave Logo Moisture Wicking Athletic All Sport Training T-Shirts	A really nice shirt for the money!  I am buying another one.  Feels like a football jersey.	2015-08-23	Nice shirt	R1K31ZFK4UVZX2	5.0	0.0	Y	N
526	152294.0	1.0	US	Apparel	B013M1IXAM	119660255.0	WildmanT Slim Adjustable ManHood Ring	Very comfortable for a starter and, doesn't hurt.	2015-08-21	Value for your first.	RSVV2I7AAT9X7	5.0	1.0	Y	N
527	3808473.0	0.0	US	Apparel	B013LTJ9O4	925017560.0	FBrand Fashion Mens Brown PU Leather Belt Z Buckle Waistband	I want a refugmnd for the belts	2015-08-28	Five Stars	R2F7JIAP3NN1TZ	5.0	0.0	N	N
528	2054294.0	0.0	US	Apparel	B013LT3I00	781578770.0	Emma's Mode Women's Lightweight Comfy Crepe Rayon Casual Pull-On Jogger Pants	I have bought this item for my wife since she likes wearing casual clothes. She loved it.	2015-08-31	She loved it.	R3R4DVUOJIUZX1	4.0	0.0	N	N
529	46841463.0	0.0	US	Apparel	B013LJR3N8	846146826.0	MUXXN Women's 1950s Retro Vintage Cap Sleeve Party Swing Dress	I love this dress! Wore it to a wedding! Fits as expected, love the color.	2015-08-24	Five Stars	R16WFDWXJXL0WY	5.0	0.0	Y	N
530	30072357.0	1.0	US	Apparel	B013LJR3HY	846146826.0	MUXXN Women's 1950s Retro Vintage Cap Sleeve Party Swing Dress	My bust is 40 1/2  and the extra large measurement was 39 1/2 ( give or take). So I ordered a size up( XXL) even though reviews said it was stretchy, because I still wanted a modest, not too tight fit. Well, I could have ordered the XL, there is enough stretch in the fabric to give an inch or so without looking tight.  Since I ordered up, I'll just take it in at the zipper, no problem.  The fabric quality is great. Not so heavy that a crinoline won't hold it out but not flimsy either.  It's  true to color( i ordered the blue/violet and its a nice deep purple) I'm  5'4&#34; and the Xxl hits me almost mid calf ( without petticoat)  shipping was fast and came two days before it was scheduled to.	2015-08-31	The fabric quality is great. Not so heavy that a crinoline won't hold ...	R36P73BEHXSY7U	5.0	1.0	Y	N
531	19682470.0	0.0	US	Apparel	B013LJR3HY	846146826.0	MUXXN Women's 1950s Retro Vintage Cap Sleeve Party Swing Dress	Beautiful color, nice look, runs 2 sizes to small.😭	2015-08-26	Dress for wedding	R172TTXWIQGPI6	2.0	0.0	N	N
532	32740554.0	0.0	US	Apparel	B013LJR3HY	846146826.0	MUXXN Women's 1950s Retro Vintage Cap Sleeve Party Swing Dress	Excellent! Worth every penny. The perfect dress if you are pear shaped and/or bottom heavy and don't want to wear the shorter dresses that are in style these days. Very feminine and lady like.	2015-08-24	Excellent! Worth every penny	R2B6L1IUFRK87X	5.0	0.0	Y	N
533	20036398.0	16.0	US	Apparel	B013LFUL8G	945895526.0	Mountain Warehouse Glacier Extreme Womens Long Waterproof Jacket	After ordering pants from Mountain Warehouse which were a perfect fit and excellent quality, I was confident ordering a few other products from them. The package arrived in a few days but with the wrong items. Here's where the company shines. I emailed them that night and the next morning I received an email apologizing and assuring me the correct items were being sent immediately and they would reimburse return shipping costs. The items arrived the next day as well as confirmation of reimbursed shipping fee.  This jacket is actually a higher quality and craftsmanship than I expected. The fit is roomy which I need for layering. Details such as velcro closures along zipper and hood are well placed, two discrete inner pockets are perfect for phone, wallet, sunglasses, keys. I love the overall quality and the color is perfect. I look forward to future purchases from Mountain Warehouse.	2015-08-27	Quality product-Excellent Customer Service	R2A60XQ4BEONO0	5.0	16.0	Y	N
534	37225507.0	0.0	US	Apparel	B013LERV4O	438198563.0	Dream Girl Boy's 9939 1 PC Gone Mental Costumes	I am writing to share a serious matter of importance as it relates to one of your children’s costumes.  I refer to your Gone Mental children’s costume, with the description that reads, “He has crazy thoughts in his head¡­he¡¯s GONE MENTAL. This pullover tunic features faux vinyl straightjacket straps with buckles detailing, blood splatters, and mental ward screen print. You¡¯d be crazy not to get one!” My younger daughter, once an honor student, athlete and musician before her illness presented during the onset of adolescence, has lived with schizoaffective disorder for the past six years, and was hospitalized as a child.  We’ve taken her to UCLA and Stanford, as well as our local hospitals, hoping to make sense of her devastating illness.  If you have ever spent anytime visiting a loved one in a children’s/adolescent’s mental health treatment facility, I assure you, you would understand that this costume is painfully cruel. Childhood suffering is not an appropriate inspiration for a Halloween costume.  And neither is adulthood suffering (note that you sell several other adult costumes that stigmatize and inappropriately portray the mentally ill). Vampires are not real.  Mummies come-to-life, monsters and zombies are not real.  Cartoon characters, fairy princesses and action heroes are not real.  Those types of costumes are appropriate to sell for children for Halloween.  But childhood and adolescent mental illness very real.  I doubt you would sell a Stage Four Cancer costume.  Why would you sell a costume that makes fun of a severe brain disorder? Stigma only encourages hopelessness and despair.  Please reconsider stigmatizing our daughter’s very real illness by removing “Gone Mental” and other mental illness inspired costumes from your inventory.	2015-08-27	Painfully Stigmatizing and Cruel	R2SFU0MPWIDYYY	1.0	0.0	N	N
535	38613473.0	8.0	US	Apparel	B013LED0TE	791544205.0	ACEVOG Women Packable Coat Jacket Windbreaker Sports Coat Long Trench Raincoat	I love the green color and the fact that it is waterproof instead of water resistant . It is a lightweight fabric and reminds me of the pack-a-ble jackets. the sleeves are a tad too long, but that is because I ordered a size larger then normal since I like to layer in colder weather. Great product!	2015-08-26	Great rain coat	R39X2LVIKNKB26	5.0	12.0	N	N
536	24666070.0	2.0	US	Apparel	B013LDHBL8	91815988.0	EagleUS Women's Stretch Neoprene Slimming Sports Capri Pants	Overall they fit ok.  They are tight through my thighs, but loose around my waist.  They are also a little shorter than expected (hit right above my knees and I'm 5'5&#34;) Overall the front is the same as the back and without a tag, I tried them on both ways.  It felt tight going over my backside, but had extra fabric in the front.  Overall they did what they were supposed to with excess sweating during my workout, but not the most comfortable fitting workout pants I own and had to readjust here and there.	2015-08-26	overall ok	R3SZKT71HQT0QH	3.0	2.0	Y	N
537	29122176.0	0.0	US	Apparel	B013LC8GWM	922417872.0	Waltzmart Womens Lucky Hand Print Cross Back Sleeveless T Shirt Vest Tank Tops	I ordered a medium for my daughter and it fits great! She loves it. She plans to wear it in the cooler weather with a jean jacket too.<br />Super cute! I received this purchase at a discount price in exchange for my honest review.	2015-08-27	... ordered a medium for my daughter and it fits great! She loves it	R35U15ONTDP9IJ	5.0	0.0	N	N
538	31580550.0	0.0	US	Apparel	B013LABZQ8	857654602.0	Expression Tees Curry #30 Golden State Basketball Kids T-shirt	It is the cheapest shirt I have ever bought. Totally disappointed.	2015-08-29	Totally disappointed.	R2CY2YQPCNM2AV	1.0	0.0	Y	N
539	41938574.0	0.0	US	Apparel	B013L1SL6O	422896910.0	J&C 1826 WOMENS BLUE Denim Stretch JEANS Destroy Skinny Ripped Distressed Pants	These are really high-rise and short I'm 5'10 these are at least 2 inches short. They are stretchy but the cut it terrible!! Would not recommend!!	2015-08-22	They are stretchy but the cut it terrible!! Would not recommend	RBOBL01UW4WN4	1.0	0.0	N	N
540	27724619.0	0.0	US	Apparel	B013L0ST80	653849108.0	Hanes Men's Classics V-Neck Tee (Pack of 6)	I bought 2xl t shirts. They are comfortable and fit the way I expected. They were shipped sooner the the original estimated date and arrived in good condition.	2015-08-27	Nice shirts	R1S7A0NXJYLQOO	5.0	0.0	Y	N
541	33698528.0	0.0	US	Apparel	B013L0KEUQ	744915149.0	Ladies Black Plus Size Short Sleeve 2 Button Blazer Zipper Back Pencil Skirt Set	Nice outfit just too small.	2015-08-28	Two Stars	R1G48OIEOVTCI6	2.0	0.0	Y	N
542	10821893.0	0.0	US	Apparel	B013KZ93SG	612030096.0	Donald Trump Men's Octagon Medallion	I thought Trump was supposed to stand for quality. Wrong!!  Not worth the price. Cheap, Cheap, Cheap.  Bought 3 ties, none are even the same length.	2015-08-28	Don't waste your money	R3ESZ7NO6PAP9Z	1.0	0.0	N	N
543	36757715.0	0.0	US	Apparel	B013KYLZ0G	566385359.0	Affliction Sinful Women Shirt Short Sleevs Heart Rose Wings Cross Vneck in Brown	Just got this today and I love it. It fits perfect!!	2015-08-30	Five Stars	R2IMGKC7P707V8	5.0	0.0	Y	N
544	29035976.0	0.0	US	Apparel	B013KYLX8A	566385359.0	Affliction Sinful Women Shirt Short Sleevs Heart Rose Wings Cross Vneck in Brown	Stitching and pattern DON'T line up with the neckline....VERY noticeable that it's off center and it looks REALLY BAD!! Returning it!	2015-08-31	VERY noticeable that it's off center and it looks REALLY BAD!! Returning it	RU2054A8O4OZ4	1.0	0.0	Y	N
545	50615807.0	0.0	US	Apparel	B013KY8A9U	693207449.0	"Baby Girls ""Scottie"" Pants with Dog Applique on Diaper Area- (Size - 6 Months)"	Very cute. Good quality	2015-08-19	Cute	RPFYPS3Z17SG1	5.0	0.0	Y	N
546	45811832.0	0.0	US	Apparel	B013KX6EQW	72679411.0	Mission Belt Strap	The product is okay. This is the 2nd belt I have had to replace because it split. I am average size. Belts are not quality product.	2015-08-30	The product is okay. This is the 2nd belt ...	R3H2MKMLJB9HEQ	2.0	0.0	Y	N
547	49523782.0	0.0	US	Apparel	B013KX47S4	72679411.0	Mission Belt Strap	"[[VIDEOID:53b2db124969d55f8671f24e58b2352]] UPDATE: This takes a learning curve to get used to. The lever that releases the pin from the teeth require that you push it in a certain direction to release it. I thought my belt was stuck, but instead of forcing it, I simply inhaled a little (to take pressure off of the belt) and that allowed me to easily push the lever and release the belt. Note that you don't want a belt that releases *too* easily, which I have experienced especially with the Bowen knife belts. (those randomly pop off, which drives me crazy)<br /><br />UPDATE x2: Dang I just saw the price on this. I'm blown away by Amazon. This is a very high quality leather belt for the price. I'm a cheap skate, and I can tell you my humble minions... this would cost twice at Nordstrom.<br /><br />✏️ Quick thoughts to supplement my video demonstration.<br /><br />I like this belt because:<br />- The nylon is nice because it's somewhat \\""floppy\\"" and isn't stiff like conventional leather. Granted it has the military type look (rather than the nicely dressed look that you'd associate with a leather belt), but the nylon is extremely durable and heavy duty and doesn't scratch up like leather. Awesome military belt if you're looking for one to hang a 45 off of.<br />- Super customization. The little notches allow me to fit it perfectly around my waste, as opposed to conventional belts that have set holes, which can be upwards of two inches apart.<br />- Looks awesome. Cool seeing a belt with no holes.<br />- Easy to put on. Stays in place and doesn't slip.<br />- Easy to take off, once you get the hang of it (see update above). Note: Do NOT force it! It'll just dig the \\""teeth\\"" MORE into the mechanism, and you'll be stuck. Just take your time, and it'll come right off.<br />- True to sizing. Don't try to go \\""a size up\\"" or \\""a size down\\"" from you pants.<br /><br />Note: I was given a sample of this product in exchange for a review and demonstration.<br /><br />Hope this helps!<br /><br />📍 Bottom line: would I recommend this product to one of my friends?<br />👍 Yes, absolutely.br /><br />📍 Bottom line: would I recommend this product to one of my friends?<br />👍 Yes, absolutely."	2015-08-26	(live video test) Coolest belt ever. Fits like a glove	R2QBS51T663H3T	5.0	0.0	N	N
548	50038974.0	136.0	US	Apparel	B013KVV1NA	234785624.0	TOP LEGGING TL Women's Comfy Versatile Warm Knitted Casual Zip-Up Hoodie Jackets in Colors	I wear lots of sweaters/sweatshirts/hoodies, because I tend to be cold a lot, and I like to layer.  Plus, I live in the Northeast, so warm clothes are a must!<br /><br />I chose this hoodie in purple, and I love the color.  It is a beautiful vibrant purple and it is just what I wanted.<br /><br />The fabric is unlike any hoodie I have had before.  The thermal material is just like you would expect - that sort of thin, waffle-like material that you would find with something like thermal bottoms.<br /><br />I put that the fit was somewhat small, because this has a slim, tight fit.  I chose size medium, and I am 5'7&#34; and about 125lbs, and the hoodie is not loose on me.  I usually wear a size 8, which is why I chose size M.  I am happy with the fit as it has a nice look to it, compared to some of my baggier, more casual hoodies.  Also this is sort of long on the torso and the sleeves, which I like, as tops are often too short on me.<br /><br />It does have a zipper, pockets (which even fit my iPhone 6, which is nice!) and a hood with drawstring.<br /><br />This is perfect for end-of-summer mornings and evenings, as the crisp fall weather is starting to move in, and good for year round when you need some extra warmth.  Overall a cute hoodie!<br /><br />I received a discount on this product in exchange for my honest review.	2015-08-30	Cute hoodie made with thermal material	R2OSHKSPXU68W5	5.0	147.0	N	N
549	47807653.0	0.0	US	Apparel	B013KUP5D8	514816965.0	Carter's Little Girls' 3 Pack Panties (Toddler/Kid)	My 3 year old loves these!	2015-08-31	Fit really well	R2TI9D6PQJNR8S	5.0	0.0	Y	N
550	2076233.0	0.0	US	Apparel	B013KTBYFM	141520426.0	Enimay Men's Casual Short Sleeve Athletic Crew Neck Striped Shirt	I love it	2015-08-28	Five Stars	R619JB72P989T	5.0	0.0	Y	N
551	21341792.0	3.0	US	Apparel	B013KQRLYI	446976988.0	WHITE APPAREL Women's Denim Vest (Basic, Destroyed, Cropped - Various)	Great quality for the price and fits true to size. I ordered a Medium and I'm a size 8 usually.	2015-08-10	Absolutely love!	R1GU52P3CFXJ0P	5.0	3.0	Y	N
552	24561037.0	0.0	US	Apparel	B013KQRKV2	446976988.0	WHITE APPAREL Women's Denim Vest (Basic, Destroyed, Cropped - Various)	Quality was good.	2015-08-23	Five Stars	R3DN19OCOTJISN	5.0	0.0	Y	N
553	14824907.0	0.0	US	Apparel	B013KP7XU6	915199246.0	Peach Couture Women's Sleeveless Casual Cocktail Party Cool Summer Maxi Dress	I LOVE this dress, very comfortable and received lots of complements from coworkers. The dress has a high waste (just under the bra line)	2015-08-20	I LOVE This Dress	R13XZCU0K7VJQM	5.0	0.0	Y	N
554	2144091.0	1.0	US	Apparel	B013KP7XU6	915199246.0	Peach Couture Women's Sleeveless Casual Cocktail Party Cool Summer Maxi Dress	,😊👍	2015-08-27	Five Stars	RFOX5Y3SAVGTV	5.0	1.0	Y	N
555	2199942.0	0.0	US	Apparel	B013KOEYU4	800686780.0	T-PARTY Blue Rose Taupe Or Teal & Grey Tie Dye Waffle Thermal New Long Sleeve Top (Medium, Teal & Grey)	Too large needed to return it	2015-08-31	Two Stars	RXHFRB6L2W92R	2.0	0.0	Y	N
556	52642004.0	0.0	US	Apparel	B013KMA748	54403262.0	Stay Cool Classic Lightweight Capri Legging	Good basic workout attire, not noticeablely cooling, according to my wife	2015-08-30	Nothing fancy	R26SEZUA7KVZN5	4.0	0.0	Y	N
557	45759441.0	0.0	US	Apparel	B013KMA0W2	54403262.0	Stay Cool Classic Lightweight Capri Legging	These were way to small and had a chemical smell! : (	2015-08-27	One Star	RLNI6PJGR0OLC	1.0	0.0	N	N
558	34904364.0	0.0	US	Apparel	B013KM9U82	54403262.0	Stay Cool Classic Lightweight Capri Legging	I to these on a whim thinking they would be great for my workouts, While they seem well made they are cut extremely small, I normally wear a 3-4 in Jr I got the small they are too small,  I would recommend if you decide to purchase these go a size up.	2015-08-22	Not what I expected	R12U78CP54EZO5	2.0	0.0	Y	N
559	35239896.0	0.0	US	Apparel	B013KM9U00	54403262.0	Stay Cool Classic Lightweight Capri Legging	They get 2 stars for the price.  I typically wear a large, but I ordered the extra large because I was unfamiliar with the brand, glad I did.  After about 2 hours of wearing these strings were already unraveling in the seams.  The seams do not seem to be reinforced.  Poor quality, will only wear around the house now and with the way the seams are deteriorating it doesn't look like I will be doing that for very long.	2015-08-21	glad I did	RLPSRZCNLK4R9	2.0	0.0	Y	N
560	37787752.0	0.0	US	Apparel	B013KM9LDG	54403262.0	Stay Cool Classic Lightweight Capri Legging	My wife loves it. Very comfortable for exercise and breathes well on the skin.	2015-08-22	worth it	R22WMGC1G7XBLA	5.0	0.0	N	N
561	51186424.0	0.0	US	Apparel	B013KDSJ3S	475245297.0	Rothco Boonie Hat	This is my 3rd Rothco boonie. All fit true to size and all great quality. This midnight camo color is unique. I'll buy more if these wear out!	2015-08-31	3 for 3	RGS4DO2TB3AEG	5.0	0.0	Y	N
562	42998657.0	3.0	US	Apparel	B013KCUECI	914367179.0	RockFlowerPaper Women's Sleepshirt/Nightgown	I just had major surgery & have hypersensitive skin. I purchased this & my doctor allowed me to wear during the surgery & post surgery. Everyone from the anesthesiologist, all my nurses in the OR & in patient floor nurses were raving about how nice it was and that the hospital needed more gowns like this!! I love it!! It does run a tad small. But I'd order these in every pattern available!!	2015-08-28	Best gown that IS 100% cotton! Super soft & Great for hypoallergenic use for sensitive skin!!	RQLLL0JBPQGYG	5.0	3.0	Y	N
563	816006.0	1.0	US	Apparel	B013KCUARC	310252420.0	OtterBox Defender Apple iPhone 6 Plus Case - American Flag OtterBox Case	As described, love it	2015-08-28	love	RYU401NV93K48	5.0	2.0	Y	N
564	40504755.0	0.0	US	Apparel	B013K7I4NO	745370245.0	Freshism Men's Machine Gun Monkey Qwel T-shirt	Was excited to get this shirt, but the problems started early. First, it was shipped to the wrong address. Second, the image looks iron-on with a large yellow box around the graphic. They assure me they don't iron-on; I'm skeptical. Third, it began to wear out with holes appearing, stitching coming loose after only a few months. They offered me 20% off another $40 shirt (I got a long-sleeve) as amends. Not happy, wish I had the cool shirt I wanted. I love you Qwel.	2015-08-08	Not happy, wish I had the cool shirt I wanted	R1JMCR5W519MF4	1.0	0.0	N	N
565	18932565.0	0.0	US	Apparel	B013K6KAG4	987211018.0	SAYFUT Waist Cincher Trainer Body Tummy Girdle Control Corset Sport Shaper Belly	I take a size 6 I bought large still to small ?	2015-08-26	One Star	R1IHB4KCZKDUIZ	1.0	0.0	Y	N
566	17011466.0	0.0	US	Apparel	B013K0CS6K	507890046.0	Hotouch 2in1 SMD Rework Soldering Station Iron Welder Hot Air Gun + Solder Tips 878AD-110V 700W	For the price is like a gift and and you have two sets in one...!!!!	2015-08-22	Hotouch 2in1 SMD Rework Soldering Station Iron Welder Hot Air Gun + Solder Tips 878AD-110V 700W	R1ZFE4CY0UYTZE	5.0	0.0	N	N
567	2802653.0	0.0	US	Apparel	B013K0CS6K	507890046.0	Hotouch 2in1 SMD Rework Soldering Station Iron Welder Hot Air Gun + Solder Tips 878AD-110V 700W	Seriously such an amazing set, comes with everything you need and is super affordable for the items that come with it. I definitely recommend this :)	2015-08-21	Seriously such an amazing set, comes with everything you need and is ...	R2NK5845I5MT1H	5.0	0.0	N	N
568	48128109.0	2.0	US	Apparel	B013JZ50ZW	224190920.0	TeeStars - Animal Lover Dog Paw Print - Love Dogs My Best Friend Women Hoodie	Very cute! I ordered it in blue and I love it. Also ships quickly.	2015-08-27	Great for any animal lover!	R3HIMNY64J122Y	5.0	2.0	Y	N
569	11003977.0	0.0	US	Apparel	B013JYDAWI	179849071.0	Womens Lace Bra Tops Wirefree Padded Sleeping Daily Bra (4pack-4 colors)	Very, very comfortable, padded wire free bra top. Off the shoulder lace gives it a sexy look, while the padding offers coverage. The super stretchy material moves and stretches with your body. The lace is also very stretchy and soft. I found the padding a little too much for me. It is a round pad directly in the center. It is a bit thicker than I usually wear, but offered excellent coverage. The off the shoulder lace, would be better if it was on the shoulder, I feel that it would be even more supportive that way. I love the no wire. I hate wearing wires, they are extremely uncomfortable for me. I got this with the intention of wearing it under a couple dresses that need a little extra coverage than a regular bra offers. It is extremely comfortable, and is a nice addition to my lingerie drawer.<br />I received this product at a discount in exchange for my unbiased review. Opinions are my own.	2015-08-29	Comfortable, wire free bra top.	R3CRCVN2VCKASH	4.0	0.0	N	N
570	34957221.0	0.0	US	Apparel	B013JY4FMM	456691191.0	TeeStars - Justice For Cecil - Cecil The Lion V-Neck Women T-Shirt XX-Large Green	I LOVE THIS SHIRT! Washed it(didn't shrink!) and wore it 3x already!	2015-08-21	Five Stars	RELCXCZWW6OY0	5.0	0.0	Y	N
571	5048030.0	1.0	US	Apparel	B013JY47TS	820979267.0	Avidlove Sexy Lingerie Women's Shimmer Petticoat Black Skirt	I ordered this in red plaid and it's way better quality than I expected! It's a good quality flannel type material. I ordered 2 sizes bigger per other reviews and it fits perfect. I was concerned about the shipping time as it ships from China but I received it in a discreet package in 9 days! Great purchase for my honeymoon!	2015-08-21	Sexy lil skirt	RT7HBEDU4G62D	5.0	1.0	Y	N
572	8991257.0	0.0	US	Apparel	B013JXQERC	174380522.0	TeeStars - Justice For Cecil - Cecil The Lion V-Neck Women T-Shirt	fits well, nice color, but has 2 stains that did not wash out....very disappointed. would gladly accept another shirt	2015-08-23	nice color, but has 2 stains that did not ...	R1BVUZ1E5WU91O	1.0	0.0	Y	N
573	37624005.0	0.0	US	Apparel	B013JX9VIG	62421301.0	I'm A Nurse To Save Time Just Assume I'm Never Wrong Nurses Gift Women Hoodie	Excellent product and price....made out of 50 cotton 50 poly so shrinkage is not an issue.  Shipping was fast.  I ordered another hoodie from same seller with different design and I'm just as pleased.  Would definitely buy again!	2015-08-24	great product and price!	R1U3VN1YEKX0GJ	5.0	0.0	Y	N
574	776312.0	0.0	US	Apparel	B013JX9LY0	833998009.0	TeeStars - Golf Evolution - Golfer Humor - Funny Golf Player Sweatshirt	Love the shirt, was delivered earlier than expected! Very happy with my purchase :)	2015-08-14	Five Stars	R20471XARD30IP	5.0	0.0	Y	N
575	39034971.0	0.0	US	Apparel	B013JV3SSM	130617656.0	SheIn Women's White Apricot Navy Color Block Shift Dress	I love this dress! I bought the white apricot navy. The colors are great together. I've received many compliments. I'm typically a size 4 and bought a medium. Perfect fit. I'm 5'1&#34; so the length isn't an issue for me. It's so light and soft and has an a-line fit.	2015-08-13	I love this dress	RORABFVBNW9BP	5.0	0.0	Y	N
576	7158905.0	2.0	US	Apparel	B013JUDMVQ	312666916.0	Halloween Pregnant Xray Skeleton Baby Boy Pregnancy Maternity Tank Top Tunic	Super cute! If you're an alternative chick this is the tank for you. I'll even wear it once my babe is here. Its very soft and stretches with your body. I'm normally a small, but got a medium because I like roomier fits. It does run a little big but still fitted well and its kinda long, but that just means you can wear leggings with it(: This is a MUST purchase!!	2015-08-30	absolutely LOVE to cute	R2FH039RF2TZEP	5.0	3.0	Y	N
577	16129991.0	1.0	US	Apparel	B013JUC0WI	312666916.0	Halloween Pregnant Xray Skeleton Baby Boy Pregnancy Maternity Tank Top Tunic	Very satisfied with this purchase. After reading others reviews first, I decided to go one size up from my original size. And it fits perfectly! Very cute shirt!	2015-08-30	Very satisfied with this purchase	R2UUDUJQK9UVK4	5.0	1.0	Y	N
578	11650071.0	0.0	US	Apparel	B013JUBJ84	312666916.0	Halloween Pregnant Xray Skeleton Baby Boy Pregnancy Maternity Tank Top Tunic	I bought this for my daughter-in-law, and she loved it. Pregnant and a Halloween enthusiast, she was thrilled with this fun shirt.	2015-08-31	A fun gift	R2KDBHTO5NDE6Q	5.0	0.0	Y	N
