	customer_id	helpful_votes	marketplace	product_category	product_id	product_parent	product_title	review_body	review_date	review_headline	review_id	star_rating	total_votes	verified_purchase	vine
772	48205113.0	7.0	US	Apparel	B013GSQELQ	843165070.0	Comfort Choice Women's Plus Size Wireless Ultimate T-Shirt Bra	It's soft and it's nice to look at. I'm completely sure that this bra would be wonderful, if it fit. Because I wear an odd size (52B), I was very careful before I ordered it to make sure I was ordering the right size. When it arrived and I tried it on, each cup was about twice the size it needed to be. Other bras from this company have been a little too large in the cup, but not large enough that I would need to send them back. I cannot say that for this one.	2015-08-18	Too much room in the cup	R85ZU9RA59Y32	2.0	7.0	N	N
773	19945094.0	0.0	US	Apparel	B013GS2MOO	865742022.0	BeWild Brand - I Am Cecil The Lion - Justice For Cecil Tank Top	great quality	2015-08-30	Statement shirt	R1ZYHA1CGV78CY	5.0	0.0	Y	N
774	13781351.0	0.0	US	Apparel	B013GO3TM2	801277488.0	Humble Chic Women's Carrie Skirt - SMALL Fit & Flare Striped Mini Skirt, Black, Ivory	Item is as described, fits as expected, fast delivery	2015-08-05	Five Stars	RILMWG5SPKA94	5.0	0.0	N	N
775	52713222.0	9.0	US	Apparel	B013GO3AB2	620958243.0	DesertWolf Vintage Leather Casual Hiking Backpack - Messenger Bag (Brown)	"[[VIDEOID:ad67fce3bc36c38978e26a7cae336891]] What a great backpack! When I received a sample in exchange for an honest review, I wasn't expecting anything beyond the normal backpack designs, but there are a number of nice features you don't usually find that are included in this one:<br /><br />=All of the leather is either double layer or backed by a tough nylon (?that's what it looks and feels like) fabric.<br />=There is a hidden handle inside a zipper slot on the back<br />=The shoulder straps are also hidden inside the zipper slot<br />=As an alternative, there is a single long shoulder strap that can be used in place of the backpack shoulder straps<br />=Everything is lined with a tough fabric that appears to be nylon<br />=There are pockets galore everywhere<br />=I managed to load a 13\\"" aluminum Macbook into the main cavity, as well as a couple of very thick books<br />=Brass finish on all of the hardware; combined with the shiny brown leather, this thing looks really cool<br />=Multiple snap shackles allow you to change carrying straps at will<br /><br />This bag looks fantastic, and will certainly last for many years. I am very impressed with the quality and attention to detail, and it has become my favorite bag for carrying my computer and numerous peripherals, as well as books, supplies, cables, etc. etc. Two very happy thumbs up for this wonderful backpack!<br /><br />Be sure to watch the video - you can see all the features and experience how the bag works!"	2015-08-26	Really Nice Leather Backpack	R2P2NQU65FMBFO	5.0	9.0	N	N
776	13604681.0	8.0	US	Apparel	B013GO3AB2	620958243.0	DesertWolf Vintage Leather Casual Hiking Backpack - Messenger Bag (Brown)	This bag is, in a word - AWESOME. I have a ton of different backpacks and bags, and this is one of the best so far.<br /><br />Just by touching the leather on the outside, I could tell that it was a great quality backpack. The leather is so soft and supple and has that scent that only genuine leather has. The gold accents are a nice touch and really add to the overall look.<br /><br />The bag is comfortable to carry in my opinion. Since the bag comes with adjustable straps, it is very easy for me to get a fit that is just right for me.<br /><br />As far as storage goes, this bag has plenty of pockets. There are two zippered pockets on the outside, two side pockets and an inside zippered pocket as well. The main compartment is very roomy. I was able to put my 15&#34; laptop inside of the bag, and I still had room left over for me to store some other odds and ends. I received the bag for review and love it. I started carrying it around with me last week and I have already received quite a few compliments on it. If you are looking for an affordable genuine leather bag that is roomy and well made, this is the one for you.	2015-08-31	An affordable genuine leather bag that is roomy and well made...	R3RJ3AJXT29D7B	5.0	8.0	N	N
777	13561885.0	3.0	US	Apparel	B013GMEXTC	659674256.0	Factor Shark Bite Youth Soccer Socks	They are really tight on my four year old but still wearable. At least I don't have to worry about them bunching on the soccer field	2015-08-26	Too cute, just a little tight	RO70OKNWUF2F	4.0	3.0	Y	N
778	46230055.0	2.0	US	Apparel	B013GDNYOG	536949807.0	Women's Two-Piece Sleeveless Crop Top Bodycon Jumpsuit Romper Clubwear	i really hate the material it makes it look really cheap and cheesy like some type of costume. the bottoms aren't really wide its like bootcut and i really want my money back !	2015-08-26	i really hate the material it makes it look really cheap and ...	R3CUO3G05YV23X	2.0	2.0	Y	N
779	25750563.0	0.0	US	Apparel	B013GCO9FK	28500772.0	Lovenest Woman's-Outlander Fan Products T-Shirts	Size is way off!	2015-08-25	Two Stars	R1WEYF99QBORTL	2.0	1.0	Y	N
780	48130660.0	0.0	US	Apparel	B013GCGHPA	409687393.0	Glamour Empire. Womens Wrap V-Neck Jersey Pencil Dress with Pockets M-2XL. 806	The dress is super cute. Material is thin, I am in between sizes having a baby a few months ago. I am normally a size 2. According to the size chart, I ordered a 6. It fit like a 2. Boo, will be returning.	2015-08-25	runs small	RCLMFSB4RZZ7P	2.0	0.0	Y	N
781	41950216.0	0.0	US	Apparel	B013GC8NQQ	886518811.0	JustinCostume Women's 1920s Sequined Retro Pattern Flapper Dress XS Beige	[[VIDEOID:1ed08f725b397e33aea8d44a127eb1ac]] Please see details in my video review. My daughter adores this dress - the only challenge to having a child wear this is that the chest has a bit more material than they need. An awesome dress.<br /><br />Please note: I received this product for free for my honest and unbiased feedback.	2015-08-24	Ornate, beautiful, runs a bit small	R2ETO139WEDOIG	5.0	3.0	N	N
782	27269551.0	0.0	US	Apparel	B013GC7DHG	639379259.0	BEARSLAND Women's Striped Long Sleeves Breastfeeding and Nursing Top	Like the material a lot as well as the design under the portion you lift to nurse. Not really long but long enough. Tight-ish but comfortable.	2015-08-24	Very satisfied.	R582IQ49ZVFTM	5.0	0.0	Y	N
783	115649.0	17.0	US	Apparel	B013GAF6OA	594959804.0	Sue&Joe Women's 3/4 Sleeve Dress Ruched Waist Classy V-Neck Casual Cocktail Dress	I was going to go out with my husband to celebrate his promotion. Unfortunately, I didn't have anything to wear and that was the reason why me and my husband pulled an all nighter looking for evening dresses, anything that would look good on me. This dress is so simple, yet so gorgeous and didn't cost us much. we really had a blast	2015-08-17	Romantic!	R3L0NJBUTJTFS8	5.0	18.0	Y	N
784	16260349.0	0.0	US	Apparel	B013G961KY	798311880.0	Coffee And Books - Ladies T Shirt Deep_royal L	Fit until I washed it for the first time.  It shrunk and is probably a small now.	2015-08-31	One Star	R3RG81P69KZ6GF	1.0	0.0	Y	N
785	11695172.0	0.0	US	Apparel	B013G8RJNI	258278163.0	Funny Birthday Gift Danger Since 1981 Birth Year - Unisex Tshirt Royal L	Great shirt.  Great price.  Delivery was fast.  Thank you very much	2015-08-16	Five Stars	R1ICK1A2U9ZSKD	5.0	0.0	Y	N
786	2310488.0	0.0	US	Apparel	B013G37668	75099793.0	RaanPahMuang Brand Striped Cotton Wrap Drive In Pants with Waist Art	fit is kinda small	2015-08-30	fit is kinda small	RXNLPV40BPIHA	3.0	0.0	Y	N
787	4949835.0	0.0	US	Apparel	B013G2RUM4	174483117.0	"Women Gathered Lose Comfort Sport Gym Dance Vest Bras Black US XS/TagM/Chest32-33"""	I got an entirely different item, it looks nothing like what in the picture, has these thin little straps, and its not a U-type bra, its a cross. Seriously unsatisfied, sending this back if i can.	2015-08-31	it looks nothing like what in the picture	R2P7NLA4BWLOKR	1.0	0.0	Y	N
788	35867319.0	0.0	US	Apparel	B013G2KFDA	639682859.0	Freedi 70 * 160cm Fall Velvet Chiffon Silk Scarf Wrap Shawl Blue	What the heck is &#34;Velvet Chiffon Silk&#34;? Is it velvet or is it chiffon? Is it made of silk or another fibre? I don't care how cheap it is, I'm not buying it unless you tell me what the thing is.	2015-08-28	"What the heck is ""Velvet Chiffon Silk""? Is it ..."	R3TPM5IXMIK9UW	1.0	0.0	N	N
789	46331263.0	0.0	US	Apparel	B013G1JOZ6	121408017.0	Jockey Women's Underwear Elance Brief - 3 Pack	I'm always pleased with Jockeys and being able to order them online is even better.	2015-01-15	Yay for Jockeys!	R35F2YF81YNRTU	5.0	0.0	Y	N
790	233340.0	13.0	US	Apparel	B013G13POW	45174745.0	Lace Short Tea Length Wedding Dresses for Bride Formal Gowns with 3/4 Sleeve	This dress is gorgeous! I was nervous about the size as they do run smaller but mine fits just right!.Shipping was faster than expected! In just a short two weeks, I will be married in this dress!!!	2015-08-22	This dress is gorgeous!	RUHYWYZFFWUTB	5.0	14.0	N	N
791	42803015.0	0.0	US	Apparel	B013FYO2WE	39113681.0	Meaneor Women's One Off Shoulder Batwing Slouchy T-Shirt Plus Size Top	Love this style!  Not only is it a great color, but it's great for relaxing at home or  still trying to be stylish for going out.	2015-08-12	Love this style	R1SECA1EZAVQ3L	5.0	0.0	N	N
792	43270205.0	1.0	US	Apparel	B013FYNMPM	39113681.0	Meaneor Women's One Off Shoulder Batwing Slouchy T-Shirt Plus Size Top	This shirt can be worn both on shoulders and off shoulders as desired. The color is deep wine red as shown in the picture. The stitching of the shirt is solid without any threads loosely hanging or pulling apart. The hem of the skirt is stretchable and gets fitted around the was it. The sleeves reach my elbow and get fitted around them. These can we born with a pair of jeans shorts and a black blazer for a chic look or long ripped jeans.<br />Sample provided without any obligations.	2015-08-19	This shirt can be worn both on shoulders and off ...	R2IGJI97X18ERY	5.0	1.0	N	N
793	40941599.0	0.0	US	Apparel	B013FVVHRU	376571096.0	Ekouaer Womens Butt Lifter Enhancer Girdle Boyshort Panties with Open Hip	Too small not comfortable at all	2015-08-29	One Star	R2ANRYAS5HTVZZ	1.0	0.0	Y	N
794	6836463.0	0.0	US	Apparel	B013FVVHRU	376571096.0	Ekouaer Womens Butt Lifter Enhancer Girdle Boyshort Panties with Open Hip	I love this thing gives me a whole new look.	2015-08-25	Great Product	R1XZ5YEPUJHAM	5.0	0.0	Y	N
795	1248942.0	0.0	US	Apparel	B013FVVEF0	376571096.0	Ekouaer Womens Butt Lifter Enhancer Girdle Boyshort Panties with Open Hip	Well fit and it works too!	2015-08-27	Well worth it	R2R182JONT2A6V	5.0	0.0	Y	N
796	12985778.0	1.0	US	Apparel	B013FUDZGM	687074213.0	Knit&Love® Women's Smart Classic Round Neck Sleeveless Knit Casual Tank Tops	I got the medium size and this tank top fits perfectly!!  The quality is excellent.It looks very smart. It is perfect to wear at work with my suits but also very nice with a pair of jeans or a skirt.  Most importantly, washing is so easy. You can put it in the washing machine in 30C (no hand wash, yey!). If it has creases it can be ironed just as long as the temperature is low (materials are 65% viscose and 35% nylon).  The top came in a very nice bag, nicely folded and well taken care of. Delivery was very prompt and seller was very nice and helpful.  Highly recommended!	2015-08-30	Very good quality!Perfect Fit!!	R2LPHKIIZ16PMI	5.0	1.0	N	N
797	42873926.0	0.0	US	Apparel	B013FU4Y9E	836950659.0	Ekouaer Women's Underbust Corset Waist Trainer Cincher Steel Boned Body Shaper Tummy Fat Burner	This fits great. There are plenty of rows of clips so the size is easily adjusted!	2015-08-31	Five Stars	R19L1QLJFXQNCO	5.0	1.0	Y	N
798	1671379.0	0.0	US	Apparel	B013FU4VQ0	836950659.0	Ekouaer Women's Underbust Corset Waist Trainer Cincher Steel Boned Body Shaper Tummy Fat Burner	Too big for the sizes posted for my waist size.	2015-08-25	Two Stars	R3UYV5WZDZHOV2	2.0	1.0	Y	N
799	107760.0	10.0	US	Apparel	B013FU4VQ0	836950659.0	Ekouaer Women's Underbust Corset Waist Trainer Cincher Steel Boned Body Shaper Tummy Fat Burner	I just ordered this waist cincher vest, as well as the regular waist cincher, on Saturday evening, August 22nd.  It's Monday and I already have it on at work.  So far it is very comfortable, but tight enough for me since I am new to waist training.  It has 6 rows of hooks, and I have it on the first one!  I will post another review in a few weeks when I see results.  But so far so good  -- shipped very fast, and the material seems to be good quality! And the best part is the price.  Other websites have these products for $50.00+.  $17.00 is definitely a great deal for this vest and cincher.	2015-08-24	I love it so far -- can't wait to see my waist slim down!	R3O9XHJ4KZNQSB	5.0	15.0	Y	N
800	45783367.0	0.0	US	Apparel	B013FU4SEU	836950659.0	Ekouaer Women's Underbust Corset Waist Trainer Cincher Steel Boned Body Shaper Tummy Fat Burner	I think I ordered a size too small or it may be the way it's suppose to be. Holds everything in. Shows a difference. Looking forward to using it while working out	2015-08-26	Great quality	R2VD0L57YLH8SS	4.0	0.0	Y	N
801	18409967.0	0.0	US	Apparel	B013FU4SEU	836950659.0	Ekouaer Women's Underbust Corset Waist Trainer Cincher Steel Boned Body Shaper Tummy Fat Burner	Could have went down a size I followed the size chart. I'm already at last row.	2015-08-30	No bra fat bulge	RQ2DUUCWA4T36	4.0	0.0	Y	N
802	41772933.0	0.0	US	Apparel	B013FU4OYO	836950659.0	Ekouaer Women's Underbust Corset Waist Trainer Cincher Steel Boned Body Shaper Tummy Fat Burner	It fits really well, I love it!	2015-08-29	I love it!	R2LG9AK9FMEI1Y	5.0	0.0	Y	N
803	24407535.0	0.0	US	Apparel	B013FU4OYO	836950659.0	Ekouaer Women's Underbust Corset Waist Trainer Cincher Steel Boned Body Shaper Tummy Fat Burner	got the one with the non adjustable strap. im 5'7&#34;, 125 lbs, A cup. fits just as I expected, not to short, not to long, straps were perfect length, and most important of all, nothing poking my sides, breasts, etc.. I didn't take a look at the actual sizing chart they had pictured with the garment, but the sizes on the scroll down tab are very accurate. I choose my size according to the size of my jeans, 26. the material is extremely sturdy, and of very good quality. I got mine in the mail in quick time, and ordered 2 more for my sisters.	2015-08-30	for the quality.. its well worth the buy for the price	R3CYZADI6SZ0KP	5.0	0.0	Y	N
804	25749333.0	0.0	US	Apparel	B013FU4OYO	836950659.0	Ekouaer Women's Underbust Corset Waist Trainer Cincher Steel Boned Body Shaper Tummy Fat Burner	i like it and all but i wish i got a smaller size bc this fits me perfectly i wish it'd actually be tight on me..	2015-08-31	i like it and all but i wish i got a ...	R3VUC9FFQ5EZ8C	4.0	0.0	Y	N
805	646781.0	3.0	US	Apparel	B013FU4M6O	836950659.0	Ekouaer Women's Underbust Corset Waist Trainer Cincher Steel Boned Body Shaper Tummy Fat Burner	Amazing corset gives me the hourglass figure I've been looking for! And reality is it does help you lose inches off your waist because when I first got it I was at the very third latch now I'm at the very end times by new one definitely buy again!	2015-08-15	CorSet fits comfortably hourglass figure!	R2ZBY2UIKZUL4U	5.0	5.0	N	N
806	30114014.0	0.0	US	Apparel	B013FTW83Y	100319512.0	Cute floral printed dresses that you can wear all day long!	Got this product on a promotional.. I like the style but it's a little bit big for xs size, elegant look..	2015-08-28	I like the style but it's a little bit big for ...	R38PHYY4483ZBT	5.0	0.0	N	N
807	42176565.0	0.0	US	Apparel	B013FTW5RS	100319512.0	Cute floral printed dresses that you can wear all day long!	I got this for my daughter who is a small and she LOVES it!<br /><br />This dress is soooooooooooooooo cute! The fit is amazing and it fells so soft!<br /><br />I received this product in exchange for a review.	2015-08-27	SUPER CUTE!!!	R1KQYF8ZK5FANC	5.0	0.0	N	N
808	123115.0	0.0	US	Apparel	B013FT6ZM4	792469364.0	iLover Women Deep-V Neck Elegant Short Sleeve Vintage Bridesmaid Dress	Really beautiful about this dress! The fabric is heavy so it falls nicely without being clingy or cheap looking.  I ordered the black and will be ordering another color shortly. Really great fitting dress (using recommended size guide) and a great deal for the price point.	2015-08-27	Really beautiful about this dress!	R3BVTSM1MNZ29Y	5.0	0.0	Y	N
809	9274702.0	0.0	US	Apparel	B013FP5DPI	664755071.0	I M Called Papa Because I M Way Too Cool To Be Called Grandfather - Unisex Tshirt Black XL	Nice quality shirt and sizes not too small.	2015-08-31	Four Stars	R1DNOU8IPLOV12	4.0	0.0	Y	N
810	32757641.0	0.0	US	Apparel	B013FOVZ74	116304460.0	Victoria's Secret Pink Full Zip Bling Hoodie Small Burgundy	I love this jacket.. It's perfect and beautiful just as pictured. Super comfy and the seller shipped quickly.. Love it!!!!	2015-08-31	I love this jacket	R3UQKLBPZMK3FC	5.0	0.0	Y	N
811	29833614.0	2.0	US	Apparel	B013FNWXH6	422503046.0	High Quality Leather Magentic Money Clip Wallet & Credit Card Holder w/ RFID Blocking Technology.	This RFID money clip is made of super incredibly soft, supple leather. Usually when I buy a new leather wallet or money clip, it takes some time before it is broken in and feels comfortable in my pocket. Right out of the box this one feels at home in your hand and pocket.<br />The stitching and seams are well done and feel like they will last a long time without any fraying or tearing.<br /><br />The money clip is unusually wide but that just means more storage. I personally only carry 6 cards, ID, a few business cards and some cash, and I've got tons of space left for more. This money clip can easily accommodate double that with ease and still remain slim and manageable. I really like the amount of pockets incorporated into the design of it as well. ID pocket, large center pocket, smaller our pocket, and 3 pocket for cards.<br /><br />The look of of the money clip is simple and understated, for me that's great because I'm not into flashy accessories. Also, the fact that it is RFID secure is not advertised in the branding, which is nice. I've used those paper sleeves for my cards before but they get annoying fast. Not to mention they wear out constantly. This entire wallet is RFID secure! No more paper sleeves. Ever.<br /><br />Overall, a very nicely constructed, larger sized, secure wallet that I will recommend to anyone I know. My one and only issue with this money clip is the ID pocket does not have a opening in it so you can easily push your ID out, and it fits in there so snugly that it's very difficult to access quickly.<br /><br />I received this item in exchange for my impartial opinion and honest review.	2015-08-29	Large size. Slim profile.	R1PU0U23LMK6AJ	4.0	2.0	N	N
812	37068100.0	1.0	US	Apparel	B013FNWXH6	422503046.0	High Quality Leather Magentic Money Clip Wallet & Credit Card Holder w/ RFID Blocking Technology.	Very nice wallet.  I've had a slim wallet for the past couple of years and doubt I'll ever go back to a regular wallet.  As for this one, I was able to easily get 6 credit cards, 2 paper cards and my drivers license into it and still have room for more.  The money clip/holder is the only thing I would prefer be a little different.  It hold 4 folded (one time) bills fairly securely.  I would hesitate to put any more than that in the clip portion.  Also, I agree with another reviewer that I would have preferred a metal (or leather-covered metal) clip instead of the leather flip which secures with magnets.  What I may do with this wallet is remove the clip portion altogether and just put bills into the center section of the wallet.  I usually don't carry a lot of cash anyway.  The leather seems to be high quality, and the wallet is super thin.  A solid 4 stars.  I did receive the wallet at a discount in exchange for an honest review.	2015-08-22	Very nice	R5GIIWGA68SO8	4.0	1.0	N	N
813	14770391.0	11.0	US	Apparel	B013FNWXH6	422503046.0	High Quality Leather Magentic Money Clip Wallet & Credit Card Holder w/ RFID Blocking Technology.	OK ..  I received the clip today, I was kinda excited to get it ( for my son). Now for the nice things about this clip, it seems to be made of nice smooth yet firm leather.  It has a pocket for an ID that has a clear window . The plastic is pretty thick and I believe it would  hold up for quite a while and take the pressure of sliding an ID in and out when need be. It has 3 slots for credit/debit cards and each slot has the RFID blocking fabric, which is nice and each area of the wallet/clip has this feature ensuring security. The wallet/clip has 2 additional larger slots for other items or addition cards/cash.  Now for the part that I do not like......... the clip! This is the part that really bothers me. I expected it to have some sort of pressure metal clip covered in leather.. it doesn't.  The clip is a leather flap that is secured with a magnet. There is a magnet in the flap of leather and a magnet in the wallet and thin magnet at that. So I tried to see how much this magnet would hold SECURELY! I started out with about 15 bills............  wouldn't hold, went to 12 bills, still wouldn't hold....went to 8 it finally started to grab the other magnet, but only after I flattened the crease smooth.  I went to 10 bills and again it barely held the cash in place. So I shook the wallet and the cash fell out. Now for something that went to great lengths  to secure your identity and credit card, not much thought was given to the clip. I also would be very hesitant to put any cash in the clip anyway for fear that it would become unattached pulling it out of a pocket and all the money would drop loose to the floor. Like I said I really wanted to love it and there are many things about it I do like. It is a nice quality, well constructed and the RFID Blocking Fabric in each slot,  but I think it needs to have a much more powerful magnet or use a pressure clip covered in leather to  hold the cash more securely.  I received this item at a discount for my unbiased opinions.	2015-08-21	I really wanted to love it.............	R278PZDCFV031I	3.0	13.0	N	N
814	128684.0	3.0	US	Apparel	B013FNWXH6	422503046.0	High Quality Leather Magentic Money Clip Wallet & Credit Card Holder w/ RFID Blocking Technology.	Nice leather with places for credit cards and ID plus a money clip my grandson uses it because he hates carrying a big bulky wallet.  The leather is smooth and appears to be high quality.  Very durable if it has withstood my grandson carrying it.  He really liked the color and the amount that it held with out be too big.  This is a nice product.<br /><br />I purchased this product at a reduced price to facilitate this review but was not compensated in any other way.	2015-08-29	Nice leather money clip with room for cards	R2GUHOLBN0DL0F	4.0	3.0	N	N
815	9731896.0	1.0	US	Apparel	B013FNWXH6	422503046.0	High Quality Leather Magentic Money Clip Wallet & Credit Card Holder w/ RFID Blocking Technology.	It seems like its a good quality but small clip wallet which cannot keep more bills on it.. This wallet is good for people who like compact size wallet and don't want to carry many cards and money around.  But overall,the  wallet leather seems to be high quality and  the RFID blocking technology makes me feel secure that people won't be randomly reading my cards and thats pretty awesome.<br /> I received this product at a discounted price in exchange for an honest and unbiased review.	2015-08-31	RFID blocking fabric,awesome one.	R3DIS2BGDX276V	4.0	1.0	N	N
816	48175141.0	9.0	US	Apparel	B013FNK6PC	80644824.0	Ezcosplay Women Off Shouder T-shirt Hollow Out Short Sleeve Wide Hem Tops Shirt	This fit is very off on this shirt, I normally wear a size medium but ordered a size large to be on the safe side. If I wanted it to have the loose look like the photo I would have needed and XL. The color is more of a sage green then an olive green. The fabric is very very soft and comfortable, the quality of the shirt itself is good. So although it is not 100% what I expected I will still be able to wear it. I have attached a photo so you can see how it looks in person.<br /><br />Disclaimer: I was given this item at a discount to review and express my unbiased opinion, my thought and feelings on this item are my own.	2015-08-30	Runs small	R2NT75EQ2D1LKI	3.0	10.0	N	N
817	2813824.0	0.0	US	Apparel	B013FNJS60	80644824.0	Ezcosplay Women Off Shouder T-shirt Hollow Out Short Sleeve Wide Hem Tops Shirt	Overall I do like this shirt, the only probably is that it's too small. I love the fabric that it's made with, it's extremely soft and light. The shoulder area  has just a big enough hole so that it's cute and comfortable. If it actually fit me right I would wear it all the time but as it's a little too tight I only wore it a few times to give an honest review about it. I love everything about this shirt other than the sizing. I received this product in exchange for an honest review.	2015-08-30	Overall great shirt.	R1UAO01VX7XVE0	3.0	0.0	N	N
